{
  "$schema": "https://json-schema.org/draft/2020-12/schema",
  "title": "Lynx evaluation handoff v1",
  "type": "object",
  "properties": {
    "schema_version": {
      "const": "1.0"
    },
    "run_id": {
      "type": "string",
      "minLength": 1
    },
    "data_kind": {
      "enum": [
        "sample",
        "evaluation"
      ]
    },
    "revision_round": {
      "type": "integer",
      "minimum": 0,
      "maximum": 3
    },
    "status": {
      "enum": [
        "pass",
        "revise",
        "stop"
      ]
    },
    "issues": {
      "type": "array",
      "items": {
        "type": "object",
        "properties": {
          "code": {
            "type": "string",
            "minLength": 1
          },
          "message": {
            "type": "string",
            "minLength": 1
          },
          "requested_change": {
            "type": "string",
            "minLength": 1
          }
        },
        "required": [
          "code",
          "message",
          "requested_change"
        ],
        "additionalProperties": false
      },
      "minItems": 0
    },
    "checks": {
      "type": "array",
      "items": {
        "type": "object",
        "properties": {
          "name": {
            "type": "string",
            "minLength": 1
          },
          "passed": {
            "type": "boolean"
          },
          "detail": {
            "type": "string",
            "minLength": 1
          }
        },
        "required": [
          "name",
          "passed",
          "detail"
        ],
        "additionalProperties": false
      },
      "minItems": 1
    },
    "historical_validation": {
      "const": "not_assessed"
    }
  },
  "required": [
    "schema_version",
    "run_id",
    "data_kind",
    "revision_round",
    "status",
    "issues",
    "checks",
    "historical_validation"
  ],
  "additionalProperties": false
}
